{
  "version": 1,
  "fallback": "Digital forensics (general)",
  "max_labels": 4,
  "editorial_types": [
    "Editorial",
    "Erratum",
    "Letter"
  ],
  "editorial_category": "Editorial & commentary",
  "special_cases": [
    {
      "id": "aboutdfir_nuggets",
      "notes": "AboutDFIR Infosec News Nuggets posts are IR/malware roundups, not general news.",
      "title_pattern": "infosec\\s+news\\s+nuggets",
      "blob_contains": "aboutdfir",
      "blob_fields": [
        "source",
        "author",
        "url",
        "id"
      ],
      "labels": [
        "Incident Response & Malware"
      ]
    }
  ],
  "categories": [
    {
      "name": "DFIR Jobs",
      "exclusive": true,
      "notes": "Exclusive first-match: hiring posts and job boards return only this label.",
      "patterns": [
        "\\bdfir jobs\\b",
        "\\bjobs (?:round[- ]?up|update|listing|board)\\b",
        "\\bdigital forensics jobs\\b",
        "\\bforensics? jobs\\b",
        "dfirdominican\\.com/dfir-jobs",
        "forensicfocus\\.com/jobs",
        "/jobs/",
        "\\bnow hiring\\b",
        "\\bwe(?:'|’| a)re hiring\\b",
        "\\bjob openings?\\b",
        "\\bopen (?:roles?|positions?)\\b",
        "\\bvacancies\\b",
        "\\bvacancy\\b",
        "\\bhiring (?:alert|round[- ]?up)\\b",
        "\\bjob (?:alerts?|postings?)\\b",
        "\\bcareer opportunit"
      ],
      "title_only": [],
      "exclude": [],
      "weak_patterns": []
    },
    {
      "name": "Mental Health",
      "exclusive": true,
      "notes": "Exclusive first-match: wellbeing and trauma posts should not also pick up topic labels.",
      "patterns": [
        "\\bmental health\\b",
        "mental injur",
        "cyber psychologist",
        "repeated exposure",
        "(?<!digital )well-?being",
        "\\bburnout\\b",
        "\\bptsd\\b",
        "vicarious trauma",
        "secondary trauma",
        "compassion fatigue",
        "occupational trauma",
        "cumulative trauma",
        "trauma exposure",
        "psychological (?:toll|distress|well-?being)",
        "cognitive fatigue",
        "\\bsuicidal\\b",
        "the job comes home",
        "oscar kilo",
        "blue light well",
        "investigator wellbeing",
        "distressing material",
        "work-related stress",
        "help-seeking",
        "forensicfocus\\.com/well-being",
        "dfir-analyst-psychological-impact",
        "protecting the people doing the hardest",
        "wellness lessons",
        "leadership and wellness"
      ],
      "title_only": [],
      "exclude": [],
      "weak_patterns": []
    },
    {
      "name": "Training and Certifications",
      "exclusive": true,
      "notes": "Exclusive. Title-only patterns catch real offerings in headlines without matching page-footer CTAs in excerpts. Exclude ML 'training', ISO 27001, and certificate-authority hits.",
      "patterns": [
        "\\btraining sessions?\\b",
        "\\btraining calendar\\b",
        "\\btraining bundles?\\b",
        "\\btraining platform\\b",
        "\\btraining news\\b",
        "\\btraining materials?\\b",
        "\\btraining philosophy\\b",
        "free (?:& |and )?affordable training",
        "\\bfree training\\b",
        "\\bdfir training\\b",
        "digital forensics training",
        "cybersecurity training",
        "\\bforensics training\\b",
        "detection engineering training",
        "cisa ir training",
        "training first responders",
        "continuous digital forensics training",
        "\\bon-demand course\\b",
        "\\bcourse review\\b",
        "\\bessentials course\\b",
        "\\bforensics? course\\b",
        "\\bgiac exam\\b",
        "\\bexam (?:prep|review)\\b",
        "certification (?:exam |prep|preparation|review)",
        "\\bcertifications?\\b",
        "\\bforensics? certification\\b",
        "sans certification",
        "magnet certification",
        "my first certification",
        "earning my .{0,40}certification",
        "cert savvy",
        "\\bicmde\\b",
        "\\biacis\\b",
        "\\bence\\b",
        "\\bcfce\\b",
        "\\bgnfa\\b",
        "\\bgcih\\b",
        "\\bcertified (?:examiner|forensic|computer|mobile|cyber|practitioner|instructor)",
        "workshop wednesday",
        "\\bworkshop\\s*[:–-]",
        "virtual threat hunting workshop",
        "forensics? workshop",
        "ransomware workshop",
        "annual workshops",
        "\\bcurriculum\\b",
        "\\bbootcamps?\\b",
        "trains your analysts",
        "how to train like",
        "oxygen forensics training",
        "amped.{0,40}training",
        "weekly .{0,30}training",
        "course at hexordia",
        "\\bfor\\d+ course\\b",
        "certified cyberdefender",
        "\\becthp\\b",
        "\\bgcfe\\b",
        "\\bgcfa\\b",
        "practical training",
        "bridging training and actual investigation",
        "dfirtraining",
        "iacis .{0,20}training",
        "#sansnetwork",
        "\\bdfir courses\\b"
      ],
      "title_only": [
        "training program(?:me)?s?",
        "\\btraining courses?\\b",
        "\\bnew training\\b",
        "certificate programs?"
      ],
      "exclude": [
        "training (?:of |an? )?(?:cybersecurity )?ml models?",
        "trained an? (?:ml |machine[- ]learning )?model",
        "machine[- ]learning models?",
        "training phase",
        "model training",
        "train(?:ed|ing) (?:an? )?(?:ml|machine[- ]learning|neural)",
        "advancing the training of",
        "no training phase",
        "iso[\\s-]?27001",
        "steam workshop",
        "trainwreck",
        "main course",
        "fake .{0,40}tutorials?",
        "lightning talk",
        "certificate (?:authority|authorities|chain|pinning|transparency)",
        "signing certificates?",
        "tls certificates?"
      ],
      "weak_patterns": []
    },
    {
      "name": "CTFs",
      "exclusive": false,
      "notes": "Capture-the-flag events, write-ups, and public DFIR datasets.",
      "patterns": [
        "\\bctfs?\\b",
        "\\bctfroom\\b",
        "#ctf\\b",
        "capture[- ]the[- ]flag",
        "evidence locker",
        "dfir datasets?",
        "dfir image compendium",
        "ctf (?:challenge|write-?up|event|pipeline)",
        "forensic challenge"
      ],
      "title_only": [],
      "exclude": [],
      "weak_patterns": []
    },
    {
      "name": "Podcasts",
      "exclusive": false,
      "notes": "New-show announcements and known DFIR podcast titles.",
      "patterns": [
        "\\bnew podcast\\b",
        "hosting a (?:new )?podcast",
        "launches? (?:a |its |their )?(?:new )?podcast",
        "introducing .{0,50}podcast",
        "podcast episode 1\\b",
        "\\binaugural (?:podcast|episode)\\b",
        "debut podcast",
        "announcing .{0,40}podcast",
        "a new .{0,25}podcast",
        "podcast series",
        "security insights show",
        "insights show episode",
        "show episode \\d+",
        "show episode #\\d+",
        "show #\\d+",
        "opensourcemalware show",
        "podcast episode",
        "podcast\\s*[–—-]",
        "\\btruth in data\\b",
        "(?:ai|mobile|legal|cyber) unpacked",
        "forensic fix",
        "i beg to dfir",
        "i bet to dfir",
        "forensic happy hour",
        "parsing the truth",
        "cybercrimeology",
        "digital forensics now",
        "\\bcache up\\b",
        "\\bunpacked #\\d+",
        "\\bs\\d+\\s*:\\s*e\\d+\\b",
        "fireside\\.fm",
        "three buddy problem",
        "securityconversations"
      ],
      "title_only": [],
      "exclude": [],
      "weak_patterns": []
    },
    {
      "name": "Mobile forensics",
      "exclusive": false,
      "notes": "Weak patterns (smartphone, mobile device/app/phone) are dropped when vehicle/infotainment exclude phrases match, so car-unit write-ups are not tagged mobile.",
      "patterns": [
        "\\bandroid\\b(?! auto)",
        "\\bios\\b",
        "\\biphones?\\b",
        "smartphone",
        "mobile forensic",
        "mobile (device|app|phone)",
        "\\bphones?\\b",
        "\\bufed\\b",
        "\\b(?:i|a|r|c|x)?leapps?\\b(?!\\.org)",
        "apple[- ]screen[- ]time",
        "digital wellbeing",
        "whatsapp",
        "telegram",
        "rednote",
        "garmin connect",
        "samsung galaxy",
        "factory reset",
        "signal (?:application|app|messenger|messages?|uninstall|forensic)",
        "apple silicon",
        "\\btizen\\b",
        "cross-platform investigation",
        "\\babx\\b",
        "android binary xml",
        "\\bsegb\\b",
        "apple biomes?",
        "\\bbiomes?\\b",
        "unified logs?",
        "dialed numbers?",
        "grapheneos",
        "graphene os",
        "notificationandsuggestiondb",
        "signal[- ]fix",
        "oxygen forensics?",
        "\\bxry\\b",
        "\\badf pro\\b",
        "passware kit mobile",
        "\\bmsab\\b",
        "gmdsoft",
        "md-series",
        "4n6 ?app ?finder",
        "4n6appfinder",
        "itunes backups?",
        "browserstate(?:\\.db)?"
      ],
      "title_only": [],
      "exclude": [
        "infotainment",
        "paired smartphone",
        "in-vehicle"
      ],
      "weak_patterns": [
        "mobile (device|app|phone)",
        "smartphone"
      ]
    },
    {
      "name": "Memory forensics",
      "exclusive": false,
      "notes": "RAM acquisition, Volatility, and live/volatile analysis.",
      "patterns": [
        "memory forensic",
        "volatility",
        "memory dump",
        "memory acquisition",
        "live forensic",
        "fileless malware",
        "volatile memory",
        "fimar",
        "\\bram (?:dump|dumps|forensic|acquisition|images?|snapshots?)",
        "application memory",
        "browser memory",
        "process memory",
        "memory scanning",
        "\\bvelociraptor\\b"
      ],
      "title_only": [],